Sample Number	Sample	Substrate category	Food type	Metabolomics	Metagenomics	NFkB_bioassay	RNAseq	ingredients	producer	main ingredient	Sample notes	all_ingredients	main_ingredient_organic_status	producer	producer_country	dominant_fermentation_chemistry	foodon_high	foodon_mid	foodon_specific	foodon_parent_label	foodon_grandparent_label	foodon_lineage	foodon_specific_canonical_id
FF0253	water kefir grains	sugar	water kefir		yes	0	0	water kefir grains	Cultures for Health	sugar	(microbial sample from FF0254)	water kefir grains	organic	Cultures for Health	US	lactic acid	plant-based food product	fermented beverage	water kefir	beverage food product	food by meal type	water kefir > beverage food product > food by meal type > plant food product	unknown
FF0254	water kefir	sugar	water kefir			2	2	water kefir grains, organic cane sugar	Cultures for Health	sugar													
FF0255	bonito flakes (katsuobushi)	Meat - fish	katsuobushi	yes		0	0	skipjack tuna (katsuwonus pelamis)	Muso	tuna													
FF0256	fermented black beans (douchi)	soy	douchi	yes	yes	2	2	black soy beans, salt	Yunhai	soybean		black soy beans, salt	not_organic	Yunhai	Taiwan	mixed koji/unknown	plant-based food product	fermented legume product	douchi	fermented bean product	bean food product	douchi > fermented bean product > bean food product > plant food product	unknown
FF0257	black garlic	Vegetable	black garlic	yes	failed	0	0	organic garlic	Wise Goat Organics	garlic													
FF0258	sorghum dosa batter	Grain/legume	dosa		yes	0	0	sorghum millet, urad dal, salt	Shastha Foods	millet	(microbial sample from FF0259)	sorghum millet, urad dal, salt	not_organic	Shastha Foods	US	mixed lactic/ethanolic	plant-based food product	fermented grain batter	dosa	multi-component rice food product	multi-component plant food product	dosa > multi-component rice food product > multi-component plant food product > plant food product	FOODON:03311571
FF0259	sorghum dosa cooked	Grain/legume	dosa			0	0	sorghum millet, urad dal, salt	Shastha Foods	millet													
FF0260	ragi dosa batter	Grain/legume	dosa		yes	0	0	Ragi flour, parboiled rice, urad dal, salt, water, ginger, chilli & curry leaves	Shastha Foods	millet	(microbial sample from FF0261)	Ragi flour, parboiled rice, urad dal, salt, water, ginger, chilli & curry leaves	not_organic	Shastha Foods	US	mixed lactic/ethanolic	plant-based food product	fermented grain batter	dosa	multi-component rice food product	multi-component plant food product	dosa > multi-component rice food product > multi-component plant food product > plant food product	FOODON:03311571
FF0261	ragi dosa (cooked)	Grain/legume	dosa			0	0	Ragi flour, parboiled rice, urad dal, salt, water, ginger, chilli & curry leaves	Shastha Foods	millet													
FF0262	Kelly Franson amazake	Grain	amazake					Rice, koji	Kelly	rice		rice, koji	organic	Cultured Pickle	US	koji	plant-based food product	fermented grain beverage	amazake	plant derived fermented beverage	fermented beverage	amazake > plant derived fermented beverage > fermented beverage > plant food product	unknown